{
  "schemaVersion": "2.1.0-contract",
  "id": "air_heavy",
  "version": 1,
  "promotionState": "candidate",
  "simulationLength": 30,
  "sourceFrames": [
    {
      "id": "air_heavy_frame_00",
      "sourceUri": "repo://NO_GODS_ABOVE/engine_v2/public/lamuh-legacy-v2/air-normals-v2/air-heavy/air-heavy-00.png",
      "width": 2048,
      "height": 1536,
      "sha256": "C2D7FE574A4B87D0DFCF8E416C86BA372B1308FB583338028A05F172E13A7BD0",
      "approvalUri": "repo://NO_GODS_ABOVE/engine_v2/content-source/characters/lamuh-legacy-v2/records/first-playable-human-review.pending.json",
      "provenanceUri": "repo://NO_GODS_ABOVE/engine_v2/content-source/characters/lamuh-legacy-v2/records/legacy-source-provenance.json",
      "metadataUri": "repo://NO_GODS_ABOVE/engine_v2/content-source/characters/lamuh-legacy-v2/records/source-frame-metadata.json"
    },
    {
      "id": "air_heavy_frame_01",
      "sourceUri": "repo://NO_GODS_ABOVE/engine_v2/public/lamuh-legacy-v2/air-normals-v2/air-heavy/air-heavy-01.png",
      "width": 2048,
      "height": 1536,
      "sha256": "067BBAAF1D1DC96AC52308A4B544010E2119CF6C9C1A313A378BEBD8D5998ED3",
      "approvalUri": "repo://NO_GODS_ABOVE/engine_v2/content-source/characters/lamuh-legacy-v2/records/first-playable-human-review.pending.json",
      "provenanceUri": "repo://NO_GODS_ABOVE/engine_v2/content-source/characters/lamuh-legacy-v2/records/legacy-source-provenance.json",
      "metadataUri": "repo://NO_GODS_ABOVE/engine_v2/content-source/characters/lamuh-legacy-v2/records/source-frame-metadata.json"
    },
    {
      "id": "air_heavy_frame_02",
      "sourceUri": "repo://NO_GODS_ABOVE/engine_v2/public/lamuh-legacy-v2/air-normals-v2/air-heavy/air-heavy-02.png",
      "width": 2048,
      "height": 1536,
      "sha256": "A7A191FFA78A7E50DF70353209BDAB648389291DED90FD1382AC68CDD418B54A",
      "approvalUri": "repo://NO_GODS_ABOVE/engine_v2/content-source/characters/lamuh-legacy-v2/records/first-playable-human-review.pending.json",
      "provenanceUri": "repo://NO_GODS_ABOVE/engine_v2/content-source/characters/lamuh-legacy-v2/records/legacy-source-provenance.json",
      "metadataUri": "repo://NO_GODS_ABOVE/engine_v2/content-source/characters/lamuh-legacy-v2/records/source-frame-metadata.json"
    },
    {
      "id": "air_heavy_frame_03",
      "sourceUri": "repo://NO_GODS_ABOVE/engine_v2/public/lamuh-legacy-v2/air-normals-v2/air-heavy/air-heavy-03.png",
      "width": 2048,
      "height": 1536,
      "sha256": "770BFB1D57ED5C44F5CEA55A41C885D5A95555453DACB6A79F72661CFBD81452",
      "approvalUri": "repo://NO_GODS_ABOVE/engine_v2/content-source/characters/lamuh-legacy-v2/records/first-playable-human-review.pending.json",
      "provenanceUri": "repo://NO_GODS_ABOVE/engine_v2/content-source/characters/lamuh-legacy-v2/records/legacy-source-provenance.json",
      "metadataUri": "repo://NO_GODS_ABOVE/engine_v2/content-source/characters/lamuh-legacy-v2/records/source-frame-metadata.json"
    },
    {
      "id": "air_heavy_frame_04",
      "sourceUri": "repo://NO_GODS_ABOVE/engine_v2/public/lamuh-legacy-v2/air-normals-v2/air-heavy/air-heavy-04.png",
      "width": 2048,
      "height": 1536,
      "sha256": "2E251098FDEEB50A9FDB031CDDC026016CED1428FA08ECF0D43B1A9F0901754E",
      "approvalUri": "repo://NO_GODS_ABOVE/engine_v2/content-source/characters/lamuh-legacy-v2/records/first-playable-human-review.pending.json",
      "provenanceUri": "repo://NO_GODS_ABOVE/engine_v2/content-source/characters/lamuh-legacy-v2/records/legacy-source-provenance.json",
      "metadataUri": "repo://NO_GODS_ABOVE/engine_v2/content-source/characters/lamuh-legacy-v2/records/source-frame-metadata.json"
    },
    {
      "id": "air_heavy_frame_05",
      "sourceUri": "repo://NO_GODS_ABOVE/engine_v2/public/lamuh-legacy-v2/air-normals-v2/air-heavy/air-heavy-05.png",
      "width": 2048,
      "height": 1536,
      "sha256": "55CEA1D28E009A8D0ECA275BDC047BA1771E5E47D3DEB5A458F8B694CBD8BCAA",
      "approvalUri": "repo://NO_GODS_ABOVE/engine_v2/content-source/characters/lamuh-legacy-v2/records/first-playable-human-review.pending.json",
      "provenanceUri": "repo://NO_GODS_ABOVE/engine_v2/content-source/characters/lamuh-legacy-v2/records/legacy-source-provenance.json",
      "metadataUri": "repo://NO_GODS_ABOVE/engine_v2/content-source/characters/lamuh-legacy-v2/records/source-frame-metadata.json"
    },
    {
      "id": "air_heavy_frame_06",
      "sourceUri": "repo://NO_GODS_ABOVE/engine_v2/public/lamuh-legacy-v2/air-normals-v2/air-heavy/air-heavy-06.png",
      "width": 2048,
      "height": 1536,
      "sha256": "8BE9AAEA3F4282D65FCCBFBB2BBBF024B2886C529DBA30AF1F6BFF897597EC4B",
      "approvalUri": "repo://NO_GODS_ABOVE/engine_v2/content-source/characters/lamuh-legacy-v2/records/first-playable-human-review.pending.json",
      "provenanceUri": "repo://NO_GODS_ABOVE/engine_v2/content-source/characters/lamuh-legacy-v2/records/legacy-source-provenance.json",
      "metadataUri": "repo://NO_GODS_ABOVE/engine_v2/content-source/characters/lamuh-legacy-v2/records/source-frame-metadata.json"
    }
  ],
  "exposures": [
    {
      "sourceFrameId": "air_heavy_frame_00",
      "start": 0,
      "duration": 4
    },
    {
      "sourceFrameId": "air_heavy_frame_01",
      "start": 4,
      "duration": 2
    },
    {
      "sourceFrameId": "air_heavy_frame_02",
      "start": 6,
      "duration": 2
    },
    {
      "sourceFrameId": "air_heavy_frame_03",
      "start": 8,
      "duration": 5
    },
    {
      "sourceFrameId": "air_heavy_frame_04",
      "start": 13,
      "duration": 4
    },
    {
      "sourceFrameId": "air_heavy_frame_05",
      "start": 17,
      "duration": 6
    },
    {
      "sourceFrameId": "air_heavy_frame_06",
      "start": 23,
      "duration": 7
    }
  ],
  "phases": {
    "anticipation": [
      {
        "start": 0,
        "end": 7
      }
    ],
    "startup": [
      {
        "start": 0,
        "end": 7
      }
    ],
    "active": [
      {
        "start": 8,
        "end": 12
      }
    ],
    "impact": [
      {
        "start": 8,
        "end": 8
      }
    ],
    "followThrough": [
      {
        "start": 13,
        "end": 20
      }
    ],
    "recovery": [
      {
        "start": 13,
        "end": 29
      }
    ]
  },
  "entryPose": {
    "id": "airborne",
    "facing": "forward",
    "elevation": "airborne",
    "plantedFoot": "none",
    "weight": "airborne",
    "weaponState": "legacy_lamuh_body",
    "handOccupancy": {
      "left": "free",
      "right": "free"
    },
    "silhouette": "airborne_lamuh_arc",
    "verticalMotion": "rising"
  },
  "exitPose": {
    "id": "airborne",
    "facing": "forward",
    "elevation": "airborne",
    "plantedFoot": "none",
    "weight": "airborne",
    "weaponState": "legacy_lamuh_body",
    "handOccupancy": {
      "left": "free",
      "right": "free"
    },
    "silhouette": "airborne_lamuh_arc",
    "verticalMotion": "rising"
  },
  "interruptPoses": [
    {
      "id": "airborne",
      "facing": "forward",
      "elevation": "airborne",
      "plantedFoot": "none",
      "weight": "airborne",
      "weaponState": "legacy_lamuh_body",
      "handOccupancy": {
        "left": "free",
        "right": "free"
      },
      "silhouette": "airborne_lamuh_arc",
      "verticalMotion": "rising"
    }
  ],
  "transitions": [],
  "landing": [
    {
      "start": 0,
      "end": 29,
      "result": "seamless_continuation"
    }
  ],
  "anchors": [
    {
      "frame": 0,
      "sourceFrameId": "air_heavy_frame_00",
      "root": {
        "x": 768,
        "y": 1360
      },
      "feet": {
        "x": 768,
        "y": 1360
      },
      "effect": {
        "x": 1088,
        "y": 940
      },
      "nearFoot": {
        "x": 768,
        "y": 1360
      },
      "farFoot": {
        "x": 768,
        "y": 1360
      },
      "groundingContract": "lamuh_legacy_v2_fixed_root_candidate_v1"
    },
    {
      "frame": 4,
      "sourceFrameId": "air_heavy_frame_01",
      "root": {
        "x": 768,
        "y": 1360
      },
      "feet": {
        "x": 768,
        "y": 1360
      },
      "effect": {
        "x": 1088,
        "y": 940
      },
      "nearFoot": {
        "x": 768,
        "y": 1360
      },
      "farFoot": {
        "x": 768,
        "y": 1360
      },
      "groundingContract": "lamuh_legacy_v2_fixed_root_candidate_v1"
    },
    {
      "frame": 6,
      "sourceFrameId": "air_heavy_frame_02",
      "root": {
        "x": 768,
        "y": 1360
      },
      "feet": {
        "x": 768,
        "y": 1360
      },
      "effect": {
        "x": 1088,
        "y": 940
      },
      "nearFoot": {
        "x": 768,
        "y": 1360
      },
      "farFoot": {
        "x": 768,
        "y": 1360
      },
      "groundingContract": "lamuh_legacy_v2_fixed_root_candidate_v1"
    },
    {
      "frame": 8,
      "sourceFrameId": "air_heavy_frame_03",
      "root": {
        "x": 768,
        "y": 1360
      },
      "feet": {
        "x": 768,
        "y": 1360
      },
      "effect": {
        "x": 1088,
        "y": 940
      },
      "nearFoot": {
        "x": 768,
        "y": 1360
      },
      "farFoot": {
        "x": 768,
        "y": 1360
      },
      "groundingContract": "lamuh_legacy_v2_fixed_root_candidate_v1"
    },
    {
      "frame": 13,
      "sourceFrameId": "air_heavy_frame_04",
      "root": {
        "x": 768,
        "y": 1360
      },
      "feet": {
        "x": 768,
        "y": 1360
      },
      "effect": {
        "x": 1088,
        "y": 940
      },
      "nearFoot": {
        "x": 768,
        "y": 1360
      },
      "farFoot": {
        "x": 768,
        "y": 1360
      },
      "groundingContract": "lamuh_legacy_v2_fixed_root_candidate_v1"
    },
    {
      "frame": 17,
      "sourceFrameId": "air_heavy_frame_05",
      "root": {
        "x": 768,
        "y": 1360
      },
      "feet": {
        "x": 768,
        "y": 1360
      },
      "effect": {